Brand,Number,Location,Price,Description,ImageNameJohn Deere 410G,229-924-0035,Dozers.com,"27,500","Description: OROPS, 2WD, EXTEND-A-HOE, AUX. HYD. QUICK COUPLER, BUCKETS FRONT AND REAR,
4 NEW TIRES,","http://static.mascus.com/image/product/large/grantstepp/john-deere-410g,2002179450.jpg"
John Deere 410G,229-924-0035,Dozers.com,"26,500","Description: Orops, Extend-A-Hoe, Aux. Hydraulic, 2WD, QC Buckets Front and Rear","http://static.mascus.com/image/product/large/grantstepp/john-deere-410g,2001585056.jpg"
John Deere 310G,229-924-0035,Dozers.com,"32,500","Description: OROPS, 4X4","http://static.mascus.com/image/product/large/grantstepp/john-deere-310g,2003344856.jpg"
John Deere 410G,229-924-0035,Dozers.com,"26,500","Description: OROPS, 2WD, Extend-a-Hoe, Aux Hyd. Quick Coupler Buckets Front and Rear, Meter reads 3,787 Hours","http://static.mascus.com/image/product/large/grantstepp/john-deere-410g,2003453172.jpg"
John Deere 410G,229-924-0035,Dozers.com,"26,500","Description: OROPS, Extend-A-Hoe, Aux. Hyd. 2WD, Q.C. Buckets Front and Rear","http://static.mascus.com/image/product/large/grantstepp/john-deere-410g,2001585634.jpg"
John Deere 670B,229-924-0035,Dozers.com,"30,000","Description: EROPS, Scarifier, Hyd. Side Shift w/Moldboard Tilt
South Carolina D.O.T. Machine","http://static.mascus.com/image/product/large/grantstepp/john-deere-670b,2000686040.jpg"
John Deere 333D,217-648-2307,Central Illinois Ag- Atlanta,"50,000","Description: 875 Hrs, Cab, Heat, Air, Hydraulic Quick Coupler, 82 bucket","http://static.mascus.com/image/product/large/centralillinoisag/john-deere-333d,2002399802.jpg"
John Deere 770D,229-924-0035,Dozers.com,"99,500","Description: Erops w/Air, Rear Ripper, Hyd SS w/Tip Control, Snow Wing, County Gov. Machine","http://static.mascus.com/image/product/large/grantstepp/john-deere-770d,2000213894.jpg"
John Deere 624K,229-924-0035,Dozers.com,"82,000","Description: EROPS/air, GP Bucket w/B.O.C.E.","http://static.mascus.com/image/product/large/grantstepp/john-deere-624k,1015930232.jpg"
John Deere 544G,229-924-0035,Dozers.com,"36,000","Description: EROPS w/Air GP Bucket, 20X25 Tires","http://static.mascus.com/image/product/large/grantstepp/john-deere-544g,1022392796.jpg"
John Deere 770CH,229-924-0035,Dozers.com,"57,000","Description: Erops w/Air, 14.00xR24 Tires, Aux Hydraulics, County Machine","http://static.mascus.com/image/product/large/grantstepp/john-deere-770ch,2000491840.jpg"
John Deere 770D,229-924-0035,Dozers.com,"99,500","Description: EROPS w/Air, Rear Ripper, Hyd. SS w/Tip Control, Snow Wing, County Gov. Machine","http://static.mascus.com/image/product/large/grantstepp/john-deere-770d,2000213746.jpg"
John Deere 544G,1-770-381-89841-678-410- ***  ...click here,"Lilburn (Atlanta), Georgia USA","35,000","1996 John Deere 544G wheel loader for sale, S/N 555472, orops canopy, 6200 hours, Pemberton hydraulic quick coupler, general purpose bucket and forks, original paint, good 20.5 X 25 skidder tires, good condition, consignment machine, contractor downsizing. Price $35,000.00. Telephone, www.cainandtoddequipment.com or reply through this post.","http://static.mascus.com/image/product/large/27c323bf/john-deere-544g,cb71a5fe.jpg"
John Deere 450DLC,1-770-381-89841-678-410- ***  ...click here,Georgia U.S.A.,"136,000","2007 John Deere 450DLC hydraulic excavator for sale, S/N 9133XX, 5211 hours, A/C, radio, 12' 10"" stick, 54"" bucket, very good original paint, right off contractor's job site, one owner machine, very good condition, very good U/C, $136,000.00. Worldwide delivery quotes available upon request.","http://static.mascus.com/image/product/large/e727c24a/john-deere-450dlc,2d34eba3.jpg"
John Deere 770CH II,229-924-0035,Dozers.com,"66,000","Description: Erops w/Air, 14.00x24 Tires, Aux Hydraulics, County Machine","http://static.mascus.com/image/product/large/grantstepp/john-deere-770ch-ii,2000188468.jpg"
John Deere 455G Series IV,1-770-381-89841-678-410- ***  ...click here,"Lilburn (Atlanta), Georgia USA","19,000","2003 John Deere 455G Series IV crawler loader, S/N 904203, 4947 hours, orops canopy, GP bucket, turbo, pedal steer, backhoe bracket, auxiliary hydraulics to the rear of the machine, good original paint, good to very good condition, weak U/C. Price $19,000.00.","http://static.mascus.com/image/product/large/e27c65d1/john-deere-455g-series-iv,096edd27.jpg"
John Deere 672A,229-924-0035,Dozers.com,"19,500","Description: AWD, 6x6, EROPS, Scarifier, 17.5x25 Tires",/images/no_pic_construction_600.gif
John Deere 624J,229-924-0035,Dozers.com,"55,000","Description: Erops w/Air, Forks, 20.5XR25 Tires",/images/no_pic_construction_600.gif
